Product Code,Product Name,Brand,Product Description,Product Features,Part Number,Barcode,Price,SRP,Commodity Code,Country of Origin,Item Weight Grams,Item Length(cm),Item Width(cm),Item Height(cm),Carton Barcode,Carton Weight Grams,Carton Length (cm),Carton Width(cm),Carton Height(cm),Carton Quantity
HCY-TOY07,Hey Clay Forest Set,HEY CLAY,Discover the joy of unlimited creativity with a colourful Hey Clay Forest Animals set!   Designed to boost kids’ imagination - this vibrant and soft modelling clay is great for sensory development and play-based learning. Developing fine motor skills as well as imagination and creativeness of your little one.   Clay air dries and hardens – so your child can keep their little treats and play them in future.,"  Includes 15 cans of air-dry clay and 2 modelling tools to make 6 characters
 FUN INTERACTIVE APP: You get FREE ACCESS to HEY CLAY® App that is a fascinating and inspiring guide to creative clay modelling for kids.
 SUPER BRIGHT COLOURS: A rainbow assortment of kids clay for unlimited creativity appeals to both boys and girls of 3 years old and up.
 CREATIVITY & EXPRESSION: Inspires curiosity to discover various shapes and colours, and imagination to create own unique craft designs.
 When the creations are finished and dried, kids can play with them and collect like toys and action figures.
 SAFE AND EASY-TO-USE: This air-dry clay is nontoxic. Does not stick to hands or stain other objects. The clay air-dries in 24 hours.
 ",E73573,5011666735736,9.89,16.99,,China,540,22.2,7.2,18.8,15011666735733,15000,72.5,32.5,43.5,4
TMY-TOY02,Tomy Bath Barista,Tomy,"Bring your favourite coffee chain to bath time with the Bath Barista from Toomies. Just like grown-ups, little ones can experience the fun of the café for themselves. There’ll be hours of chat and fun in the bath as they brew their very own make-believe cappuccinos.   The fun starts at the top: on the left is a spinner they can set in motion simply by pouring water with the smiley-faced jug provided. Place a cup under the filter and give the yellow handle a twist to serve up a classic cup of Joe! Up top on the right is the handy foamer. Lift the lid, add in some bubble bath and water, then start pumping the yellow plunger to create oodles of frothy bubbles! It’s as easy as 1, 2, 3! Turn the yellow dial and see the creamy foam plop, plop, plop into the cup below. It’s a foam-accino! Add a finishing touch with the shaker: the colourful hundreds and thousands won’t escape, but water sprinkles will!   Included are 3 cups and a jug and there’s a handy storage space on the left where they can all stack. The entire set fits easily to wall tiles, bath sides and any smooth surface thanks to suction pads at the back.","  Just add soap and water: Create make-believe cappuccinos for instant coffee-making fun!
 Café role play: Brimming with dials, levers, shakers and spinners, fill the jug and cups to keep those orders coming!
 Froth it up: Pump action frother allows you to top your brew at the twist of a button; sprinkler adds a finishing touch.
 Perfect for little hands: This tub-side toy builds confidence around water, boosting fine motor skills as children explore cause and effect.
 Chat over a cuppa: Ideal for storytelling fun at bath time, capture your children’s imagination as they learn to share and communicate.
 Suitable from 18 months+
 ",E73547,5011666735477,14.49,22.99,,Vietnam,770,35.24,13.02,27.94,15011666735474,2095,36.83,27.94,30.8,2
TMY-TOY03,Tomy Bubble & Bake Bathtime Kitchen,Tomy,"With the Bubble & Bake Bathtime Kitchen from Toomies kids can step into the tub and into the kitchen all at once!   They can make believe they’re cooking up a mouth-watering feast with a versatile oven/hob cooker combination and a kitchen sink with working tap! Add a few drops of bubble bath and send thousands of bubbles ‘boiling’ over the top!   There’s a ladle for scooping and stirring, plus a pie dish that slides in past the oven door.","  Bubble ‘n’ squeak: Bring all the fun of the kitchen into the bath tub with this clever 2-in-1 play set that lets little ones pretend they’re cooking up a feast.
 Sink or simmer: Includes a sink unit with working pump-action tap, plus an oven-and-hob combination. Mount each individually or lock together to encourage sharing and cooperative play.
 Just add water: Pop the pot on the hob and pump the yellow button to see bubbles appear. Add bubble bath to send foam spilling over the top!
 Pour and spin: Place the pie dish in the oven, twist the pot up top to send the water pouring down into the oven, and watch as it sets the pie dish spinning!
 Winning combination: Imaginative role play builds confidence in water, fosters interaction and promotes communication skills. Kids can explore cause and effect and develop
 Suitable from 18 months+
 ",E73264C,5011666732643,13.39,22.99,,Vietnam,990,34.92,18.1,27.94,15011666732640,2893,38.1,36.83,31.11,2
TMY-TOY05,Tomy Splash & Rescue Helicopter,Tomy,"Landing in a tub near you is the Splash & Rescue Helicopter from Toomies.   This colourful floating bath helicopter is packed with fantastic water play features. Rescue the dolphin from danger and take him for a ride in the bucket. Place him inside and winch it up by turning the blue rotor. Turn dolphin on his head and discover another pouring action!   Every bath time becomes an epic rescue adventure as children fire their imaginations and gain confidence around water, developing their motor skills and exploring a host of connections that have cause and effect.","  To the rescue: Bring the fun and excitement of ocean rescue to bath time with this all-action, water splashing, helicopter bath toy
 In a spin: Fill with water and set the helicopter rotors spinning by pulling the rescue bucket
 Spray away: Fill the rotor with water and see it spray a full 360 as it whizzes round and round
 Let it pour: Rescue the dolphin in the bucket – both are designed to fill and pour streams and showers of water
 Puppy Pilot: Cute and squidgy, the pilot squirts water and attaches to tubs and tiled walls
 Suitable from 12 months+
 ",E73305,5011666733053,8.09,13.99,,Indonesia,380,23.49,15.87,16.19,15011666733050,879,33.02,23.81,17.14,2
VTC-GYM01,VTech 6-in-1 Playtime Tunnel,VTech,"Meet Zebra and their fun multi-coloured 6-in-1 Playtime Tunnel by VTech®!   Detach the electronic piano panel for on-the-go play. Press the light up piano keys for fun responses. Little one can spin the beads on the piano handle and flip the Sloth around the arch tree to develop their motor skills. The soft fabric arch and leaves promote tactile stimulation and sensory discovery. Little one can explore and crawl through the see-through rainbow mesh tunnel.   Features dangling self-discovery mirror and 5 animals: fabric tiger, crinkle fabric toucan, elephant rattle, easy-grasp handle koala with beads and roller ball hippo. Product length: 94cm.","  Detachable piano panel for on-the-go play
 Light up piano keys trigger fun responses
 Includes soft fabric arch, and leaves for tactile stimulation and sensory discovery
 Features dangling self-discovery mirror and 5 animals
 Product length: 94cm 
 Suitable from 3 to 36 months
 ",562703,3417765627033,49.59,79.99,9503009990,China,1850,77,47,47,33417765627034,6000,63.3,29.1,43.3,2
VTC-GYM04,VTech 4-in-1 Tummy Time Fawn,VTech,"Introducing the 4-in-1 Tummy Time Fawn by VTech®! This soft, cuddly tummy time pillow includes 4 ways to play.   As your little one grows the fawn will provide and support tummy time, sitting, take along and on the go play. Soft textures support and encourage tactile awareness.   As your little one grows and develops the detachable hippo rattle, self-discovery fox mirror and electronic piano keep little ones engaged. Light up piano keys on the removable piano introduce animals and play piano notes, sounds, sing-along songs and melodies.   Fawn has multiple textures, patterns and colours for visual and tactile stimulation.   Includes 15 exciting melodies and 4 fun sing-along songs.","  Soft, cuddly tummy time pillow with 4 ways to play
 Supports and encourages tummy time play
 Includes detachable hippo rattle, self-discovery fox mirror and electronic piano
 Light up piano keys on the piano introduce animals and play piano notes, sounds, sing-along songs and melodies
 Fawn features lots of textures, patterns and colours for visual and tactile stimulation
 Includes 15 melodies and 4 sing-along songs
 Suitable from 3 to 36 months
 ",560503,3417765605031,21.69,34.99,9503009990,China,538,47,11.2,41.5,33417765605032,4710,41.5,48.3,32.4,4
VTC-TOY130,VTech Toot-Toot Drivers® Ambulance,VTech,"Hi, I'm a reliable Ambulance, heading off to the rescue. Zoom into the learning zone with the Toot-Toot Drivers® Ambulance by VTech®.   This cute and chunky ambulance is perfectly sized for little hands and will entertain with the light up face button that triggers fun music, realistic sound effects and songs. Push the ambulance or press the feature button for more fun reactions and movements.   Includes 3 sing-along songs and 6 lively melodies. Encourages motor skills, role-play fun, language development and imaginative play. Introduces singing, pretend play and sounds.   The ambulance responds to SmartPoint™ locations with different phrases, sound effects and more on Toot-Toot Drivers® play sets (each sold separately).","  Chunky ambulance will entertain your child with the light up face button that triggers fun music, realistic sound effects and songs
 Push the ambulance or press the feature button for more fun reactions and movements
 Includes 3 sing-along songs and 6 lively melodies
 Encourages motor skills, role-play fun, language development and imaginative play
 Introduces singing, pretend play and sounds
 Responds to SmartPoint™ locations with different phrases, sound effects and more on Toot-Toot Drivers® play sets (each sold separately)
 Suitable from 1 to 5 years
   ",565403,3417765654039,5.59,8.99,9503009590,China,120,10.6,5.8,6,33417765654030,3200,25.5,24.5,28.6,12
VTC-TOY131,VTech Toot-Toot Drivers® Tow Truck,VTech,"Hi! I'm a terrific tow truck! I'll tow you to the garage! Drive into the learning zone with the Toot-Toot Drivers® Tow Truck by VTech®.   This chunky tow truck is perfectly sized for little hands and will entertain your child with the light up face button that triggers fun music, sounds and songs. Push the tow truck or press the feature button for more fun reactions.   Includes 3 sing-along songs and 6 lively melodies. Encourages motor skills, role-play fun and imaginative play. Introduces singing, pretend play and sounds.   Tow truck responds to SmartPoint™ locations with different phrases, sounds and more on Toot-Toot Drivers® play sets (each sold separately).","  Cute, chunky tow truck your child will love!
 Press the light up face button to triggers fun music, sounds and songs.
 Push the tow truck or press the feature button for even more fun reactions.
 Includes 3 sing-along songs and 6 lively melodies.
 Encourages motor skills development & role-play.
 Responds to SmartPoint™ locations with different phrases, sound effects and more on Toot-Toot Drivers® play sets (each sold separately).
 Suitable from 1 to 5 years
 ",557803,3417765578038,5.59,8.99,9503009590,China,120,9.8,5.5,5.9,33417765578039,2000,25.5,24.5,28.6,12
VTC-TOY132,VTech Toot-Toot Drivers® Sports Car,VTech,"Drive into the learning zone with the Toot-Toot Drivers® Sports Car by VTech®.   This cute and chunky sports car is perfectly sized for little hands and will entertain your child with the light up face button that triggers fun music, realistic sound effects and songs. Push the sports car or press the feature button for more fun reactions and movements.   Includes 3 sing-along songs and 6 lively melodies. Encourages motor skills, role-play fun, language development and imaginative play. Introduces singing, pretend play and sounds.   Sports car responds to SmartPoint™ locations with different phrases, sound effects and more on Toot-Toot Drivers® play sets (each sold separately).","  Cute, chunky sports car will delight little ones!
 Light up face button triggers fun music, realistic sound effects and songs.
 Push the sports car or press the feature button for more fun reactions and movements.
 Encourages motor skills, role-play fun and imaginative play.
 Includes 3 sing-along songs and 6 lively melodies.
 Introduces singing, pretend play and sounds.
 Responds to SmartPoint™ locations with different phrases, sound effects and more on Toot-Toot Drivers® play sets (each sold separately).
 Suitable from 1 to 5 years
 ",565303,3417765653032,5.59,8.99,9503009590,China,120,10.6,5.8,6,33417765653033,2850,25.5,24.5,28.6,12
VTC-TOY133,VTech Toot-Toot Drivers® Dumper Truck,VTech,"I'm an energetic dumper truck. Hard, tough work is easy for me. Drive into the learning zone with the Toot-Toot Drivers dumper truck by VTech.   This fun and fabulous dumper truck is perfectly sized for little hands and will entertain your child with the light up face button that triggers fun music, realistic sound effects and songs. Push the dumper truck or press the feature button for more fun reactions and movements.   Includes 3 sing-along songs and 6 lively melodies. Encourages motor skills, role-play fun, language development and imaginative play. Teaches singing, pretend play and sounds.   The dumper truck responds to SmartPoint™ locations with different phrases, sound effects and more on Toot-Toot Drivers play sets (each sold separately).","  Chunky dumper truck will delight your little one with the light up face button that triggers fun music, sounds and songs
 Encourages motor skills, role-play fun, language development and imaginative play
 Dumper Truck responds to SmartPoint™ locations with different phrases, sound effects and more on Toot-Toot Drivers® play sets (each sold separately)
 Includes 3 sing-along songs and 6 lively melodies
 Suitable from 1 to 5 years
 ",565503,3417765655036,5.59,8.99,9503009590,China,120,10.6,5.8,6,33417765655037,2000,25.5,24.5,28.6,12
VTC-TOY134,VTech Toot-Toot Drivers® Fire Station,VTech,"Hurry, hurry! Let’s race to the emergency! Ring the bell and launch the SmartPoint™ fire engine down the ramp and off to the fire.   Spiral track links up with the lift for varied track play, change the route of the tracks using the chunky lever!   Play set includes four SmartPoint™ locations that trigger fun phrases and sounds when driven over with the included Toot-Toot Fire Engine or other Toot-Toot vehicles.   Manipulative features include twisting flag, swing-up fire station door, flip down fire and fuel pump. Also includes fire & fire extinguisher accessories.   Fire Engine includes fun sing-along songs and melodies.","  Ring the bell and launch the SmartPoint™ fire engine down the ramp and off to the fire
 Spiral track links up with the lift for varied track play, change the route of the tracks using the chunky lever!
 Play set includes four SmartPoint™ locations that trigger fun phrases and sounds when driven over with the included Toot-Toot Fire Engine
 Manipulative features include twisting flag, swing-up fire station door, flip down fire and fuel pump
 Also includes fire & fire extinguisher accessories
 Fire Engine includes sing-along songs and melodies
 Suitable from 1 to 5 years
 ",543003,3417765430039,24.79,39.99,9503009590,China,1627,76.2,35.7,36.6,33417765430030,8898,34,53.5,46.5,4
VTC-TOY135,VTech Toot-Toot Drivers® Construction Set,VTech,"Drive and work around this exciting new Toot-Toot Drivers® Construction Site by VTech®! Launch the included Toot-Toot dumper truck from the very top and watch as it scoots down the corkscrew track onto the cradle and down the second track!   Lift, track splitter and rock chute add to the role-play fun and help transport your Toot-Toot vehicles around the construction site. Load the dumper truck with the rock accessories to transport them! Play set includes six SmartPoint™ locations that trigger fun phrases and sounds when driven over with the included dumper truck or other Toot-Toot vehicles.   Truck includes three sing-along songs, melodies and lots of fun realistic sound effects.","  Drive and work around this exciting Toot-Toot Drivers® Construction Site by VTech®!
 Launch the included Toot-Toot dumper truck from the very top and watch as it scoots down the corkscrew track onto the cradle and down the second track!
 Lift, track splitter and rock chute add to the role-play fun and help transport your Toot-Toot vehicles around the construction site
 Load the dumper truck with the rock accessories to transport them!
 Play set includes six SmartPoint™ locations that trigger fun phrases and sounds
 Dumper includes three sing-along songs, melodies and lots of realistic sound effects
 ",543503,3417765435034,37.19,59.99,9503009590,China,3350,100,79,58,33417765435035,8420,31.2,59.5,43,2
VTC-TOY137,VTech Switch & Go Dinos® Dino Launcher 2-in-1,VTech,"Let's get launching! The Switch & Go Dinos® Dino Launcher 2-in-1 is here!   This amazing 2-in-1 toy by VTech® includes 2 dinos that can switch and combine into 1! Rip the Pterodactyl and Shred the Spinosaurus combine to form a mighty super car! Shred can be switched into a cool race car, while Rip can be switched into a vehicle launcher! Connect the two together to form a mighty super car!   Press the launcher button to release Shred and watch as he burns rubber! Hear cool dino and vehicle sound effects with Shred as you play, as well as fun phrases and dino facts! Let's Switch & Go!","  Combine Rip & Shred to form a mighty super car!
 Switch Shred the Spinosaurus into a race car and back again in just a few simple steps!
 Hear fun phrases and great sound effects in both Spinosaurus mode and race car mode!
 Rip the Pterodactyl switches into a launcher, so you can launch the race car for a speedy getaway!
 Switch Rip back into a Pterodactyl in just a few simple steps!
 Suitable from 3 to 8 years
 ",549303,3417765493034,16.69,26.99,9503004990,China,840,24.5,13.2,9.4,33417765493035,5000,56.1,37.3,26.8,4
VTC-TOY138,VTech Switch & Go Dinos® Rescue Raiders 3-in-1,VTech,"Rescue Raiders, assemble! Introducing the Switch & Go Dinos® Rescue Raiders 3-in-1 by VTech®!   These 3 mighty rescue vehicles (police car, helicopter and fire engine) combine together in a few simple steps to become a truly mega Rescue-Rex! Hear lively sound effects and fun phrases as you switch & go! See cool dino eye and driver animations on the LCD screen!   Lights illuminate the Rescue-Rex mouth and the police car emergency lights for added fun! Extend and spin the fire engine ladder! Spin the helicopter rotor blades! And bring the Rescue-Rex to life with over 20 articulations! Let's Switch & Go!","  Three rescue vehicles (Helicopter, police car, fire engine) join together to assemble one mega Rescue-Rex!
 Hear amazing sound effects and fun phrases as you switch & go!
 The LCD displays cool police car and T-Rex animations!
 LED lights illuminate T-Rex’s mouth and the police car’s emergency lights!
 Extend and rotate the fire engine ladder!
 Spin the rotor blades of the helicopter!
 Over 20 articulations!
 Suitable from 3 to 8 years
 ",549503,3417765495038,27.89,44.99,9503004990,China,1720,53.2,23.2,31.5,33417735495039,9000,56.1,35.3,47.7,4
VTC-TOY139,VTech Animal Friends Boat,VTech,"Sail away on the Animal Friends Boat By VTech®. Place the animals on the interactive SmartZone and they will invite you to play along, giving different responses when the house is on or off the boat for 2-in-1 play!   Press the trigger button to launch the animals and the captain down the slide! House includes a light up lantern button and 3 object buttons that introduce greetings, animals, colours, seafaring objects and play lots of songs and melodies.   Build motor skills by twisting the anchor, turning the gears, opening & closing the porthole and rotating the watchtower! Pull the boat along to trigger the motion sensor and store all the characters in the hold!","  Join your animal friends and sail away on the Animal Friends Boat By VTech®
 Place the animals on the interactive SmartZone and they will invite you to play along, giving different responses when the house is on or off the boat for fun 2-in-1 play!
 Press the trigger button to launch the animals and the captain down the slide!
 House includes a light up lantern button and 3 object buttons that introduce greetings, animals, colours, seafaring objects
 Build motor skills by twisting the anchor, turning the gears, opening & closing the porthole and rotating the watchtower!
 Pull the boat along to trigger the motion sensor and store all the characters in the hold!
 Suitable from 1 to 5 years
 ",566003,3417765660030,24.79,39.99,9503009590,China,790,37.5,11.8,28,33417765660031,4500,56.1,47.3,35.7,4
VTC-TOY140,VTech Toddler Tech Laptop,VTech,"Encourage essential early computer skills with the Toddler Tech Laptop by VTech®.   This pre-school laptop includes over twenty games in five fun categories: Alphabet & letters, patterns & shapes, numbers, logic & matching and music & French.   Levelled learning and quiz mode encourage repetitive play. Customisation feature allows you to personalise your child’s experience by creating their own character and wallpaper for extra fun!   Along with the easy to use abc keyboard & mouse the back-lit screen all make playing with this laptop a breeze!   Encourages logical thinking, visualisation skills and hand-eye co-ordination.","  Everything you need to encourage essential early computer skills!
 Toddler Tech Laptop
 Includes over twenty games in five fun categories: Alphabet & letters, patterns & shapes, numbers, logic & matching and music & French
 Levelled learning and quiz mode encourage repetitive play
 Customisation feature allows you to personalise your child’s experience by creating their own character and wallpaper
 Back-lit screen
 Easy to use
 ABC keyboard & mouse make playing with this laptop a breeze!
 Encourages logical thinking, visualisation skills and hand-eye co-ordination
 Suitable from 2 to 5 years
 ",524803,3417765248030,17.39,27.99,9503008700,China,720,30,4.8,16,33417765248031,4500,34.8,34.1,35.7,4
VTC-TOY141,VTech Toddler Tech Laptop pink,VTech,"Encourage essential early computer skills with the Toddler Tech Laptop by VTech®.   This pre-school laptop includes over twenty games in five fun categories: Alphabet & letters, patterns & shapes, numbers, logic & matching and music & French.   Levelled learning and quiz mode encourage repetitive play. Customisation feature allows you to personalise your child’s experience by creating their own character and wallpaper for extra fun!   Along with the easy to use abc keyboard & mouse the back-lit screen all make playing with this laptop a breeze!   Encourages logical thinking, visualisation skills and hand-eye co-ordination.","  Everything you need to encourage essential early computer skills!
 Toddler Tech Laptop
 Includes over twenty games in five fun categories: Alphabet & letters, patterns & shapes, numbers, logic & matching and music & French
 Levelled learning and quiz mode encourage repetitive play
 Customisation feature allows you to personalise your child’s experience by creating their own character and wallpaper
 Back-lit screen
 Easy to use
 ABC keyboard & mouse make playing with this laptop a breeze!
 Encourages logical thinking, visualisation skills and hand-eye co-ordination
 Suitable from 2 to 5 years
 ",524853,3417765248535,17.39,27.99,9503008700,China,720,30,4.8,16,3341775248536,4500,34.8,34.1,35.7,4
VTC-TOY142,VTech Snuggly Sounds Whale,VTech,"Introducing the Snuggly Sounds Whale by VTech®. This cute and soft fabric whale is sure to give little one a whale of a time!   The five rainbow piano keys play sound effects and introduce numbers and ocean animals! Press one of the two tail buttons to enjoy calming nature sounds or 9 songs and 15 melodies. Features a dangling fabric fish, easy-to-grasp crinkly sound fins and mirror for self-discovery! Whale's light up heart button triggers even more fun responses!   The Snuggly Sounds Whale includes various textures for tactile stimulation, such as ribbons, velour and corduroy, which encourages sensory exploration! Fabric and stuffing made from recycled plastic bottles.","  Fabric and stuffing made from recycled plastic bottles
 Rainbow piano keys play sound effects and introduce numbers and ocean animals!
 Press one of the two tail buttons to enjoy calming nature sounds or 9 songs and 15 melodies
 Dangling fabric fish and mirror for self-discovery!
 Light up heart button triggers more responses!
 Various textures for tactile stimulation!
 Suitable from 3 to 24 months
 ",562803,3417765628030,20.39,32.99,9503004100,China,230,11,32,6.5,33417765628031,3074,34.5,55,25.5,4
